text,label
"So there aren`t anymore exams, but there is only 3 days left. I`ve just now relized this is a bad thing.  And a good thing. I dont know.",neutral
"I use an external track ball with my laptop. Again, seems excessive, but is totally more efficient.",positive
love it! Really its simple i think of a word and put twi on the front i should be more clever,positive
Can`t sleep but is happy that the Fugees are keeping him company,neutral
Getting ready to tackle a new DIY project. Can't wait to see how it turns out!,neutral
Writing in yearbooks make me wanna cry,negative
"It`s my wall, and I like saying I banned Zac Efron  lol sonny",positive
I can't stand how perfect everyone's life looks on social media. Mine is a mess.,negative
"Making a video for HitRecord... hope it comes out well, it`ll be my first record",positive
RAIN why must you come 'after' I flat iron my hair? I have been rockin my curls for 3 weeks and today you decide to come out. not nice!,neutral
Hey friends! Just here to remind you that you are enough and capable of achieving anything you set your mind to. Believe in yourself and go after your dreams!,positive
@_Bella_Cullen13  _Cullen26  _Cullen10  These are my family girls  love u guys *smiles*,positive
That comment really hurt my feelings. I can't stop thinking about it.,negative
http://twitpic.com/4wf3a - the definition of true beauty,positive
WOOOOOOOOOO   are you coming to Nottingham at any point?  lovelovelove<3,positive
Recording an acoustic track! For you sexy kids!,neutral
Greetings to all my lovely followers. Thank you for your continuous support and encouragement. You make my day brighter!,positive
Still haunted by the emotional wounds inflicted by someone I thought I could trust.,negative
my stomach feels like it`s touching the ground..i`m SO full,negative
"So envious of my friends' achievements, wish I had the same success.",negative
"I assume you mean 2nd item with 3 nested lines, but no invert call tree button to be found   ??????  ??????   ??????",negative
"Hmm, $25 to see the Decemberists, but I have to go to Raleigh on a work night... or $95 for cheap seats to the Bolshoi? Probably neither",negative
I think the rain killed my phone,negative
Just got home from dinner with my mommy and my new grandma. I`d rather be in Hollywood right now,neutral
The thunderstorm scared the life out of me. I hate this weather.,negative
Can you talk to my hubby  and convince him that that`s a great present for ALL mommies???,positive
Sending you lots of love and good vibes.,positive
You`re not here. I hope you`re still resting.  I don`t want you to be stressed.,positive
Congratulations to my best friend on her new baby! Wishing you all the joy and love in the world as you embark on this beautiful journey of motherhood. #newmom,positive
Being followed by compliance.  Great.   Have to watch what I say now.,positive
"Luke M here, thanks Ps Chris! Ur husband is pretty cool I reckon! Sorry u were feeling sick and hope you feel better soon!",neutral
Happy Friday! Let the weekend adventures begin!,positive
HAPPY MOTHER DAY TO ALL THE MOTHER`S IN THE ENTIRE WORLD WE DESERVED A DAY JUST FOR US RIGHT...,positive
"Shite night, tomorow, I get to hang out with my little brother and neice, should be sufficient enough to change my mood",positive
Chilling with my baybee sarah!  i love this girl,positive
i havent been out west since 07...i think i picked a bad wknd b/c its overcast out here tho,negative
"going to watch a dvd with hubby,`Eagle Eye`, twit u all 2morrow, cia",neutral
_KHC wooow. lucky XD my break is gonna end. my classes starts @ june 4,positive
"...wait, I lied.",negative
had a life changing redhead - she got away,neutral
Feeling so jealous of those who get to experience incredible things.,negative
goodnight all in the twitterverse,positive
i have no idea wtf im doing,negative
Ok then have a good day,positive
Went to see 'UP'. It was a really good movie that pulls at the heart strings  i highly recommend it,positive
"Stuck in traffic once again, will never get anywhere on time.",negative
I`m going to see sweeney todd on stage with my best friend for her bday today (I know I`m going to be the one who sings along!!),positive
"I`m the same way, but with Backstreet Boys. I remember gasping when they used 1 song on Chuck  I was like O.O OMFG NO WAY",negative
Feeling grateful for the amazing people in my life. Surrounding myself with positive energy!,neutral
Sooo much work so little time,negative
_Anderson your tweets were awesome  **** the heat. That`s what dencorub is for,neutral
"?  ... thx for ur msg, so awesome!  luv the new single! xoxo http://tr.im/kpDW",positive
Hi frenchie *-* i`ll do that...later  :p,neutral
"deleted a lott of facebook friends, ask to be my friend again if you want. if not idgaf",negative
"Ouch, my back is killing me. Can't even sit properly.",negative
I queue for cake standing up and with a slight look of deranged anticipation on my face.,neutral
"Might buy some iPod apps later, hmmm...",neutral
Everything feels so hopeless right now. I can't see a way out.,negative
"Just finished a challenging workout, feeling accomplished.",neutral
_tastic Awww that is sweet,positive
hiccups,neutral
Had a great catch-up call with an old friend. It's amazing how time flies but friendship remains strong.,neutral
"think I`m gonna start writing a proper blog, can anyone recommend any good blog host thingys?",positive
Just ate way to many chocolate animal crackers,negative
thinks that Pipers molars are cutting thru  we had a nice lil nap me and the girl...now just another friday night at home w/ the lil ones,neutral
"Still struggling with the emotional pain caused by a betrayal, it's unbearable.",negative
thanks **** it went really well. I`m tired now though  hope you spoiled your mum-in-law,neutral
Greetings to all my fellow book lovers. May you always find solace and joy within the pages of a good book. Keep reading!,positive
"Thanks dear, I know this, but I appreciate the validation as always",positive
so Roman is now on pain killers and some LQ meds. Thanks Jess for agreeing to go get him yogurt before you go out!,neutral
Pineapple rocks bud,positive
This headache is killing me. I can't focus on anything.,negative
borred what everyone doingn check out links on my profile,negative
So jealous of those who get to live a carefree life full of adventures.,negative
About to leave the fights. I`m tired and my voice hurts.,negative
Not a happy camper  not having a good day at all...,negative
"Schoool needs to end, Work tonight 4 to 8  hittt me up after <3",neutral
"Still carrying the emotional baggage of past hurts, it weighs me down.",negative
"Happy New Year! May this year bring you success, happiness, and all your heart desires. Cheers to an amazing year ahead!",positive
"No more tickets for today.  Having dinner with Mimcy after work, then we head home. Then again, she might get a call",neutral
"Still dealing with the heartbreak caused by a lost love, it's painful.",negative
Still hurt by the emotional scars left by a toxic relationship.,negative
Why does life have to be so hard? It feels like I can never catch a break.,negative
"Another day, another letdown. When will things go my way?",negative
Wishing you all a fantastic day! Remember to always chase your dreams and never give up on what you believe in. You got this!,positive
Can you please  with that? I`d love some egg +bacon +ranch +bed for giving birth 3 times in 4 years!,positive
Avoided cinder blocks! Safe in NY area.. But Dantas and porky upset beavs gone,neutral
I can`t wait to see yall Friday !!!! I hope I meet u guys!! That would make the night even better,positive
"The subway system is always delayed, making me late for appointments.",negative
Happy holidays to everyone! Wishing you all a joyful and relaxing time with your loved ones.,positive
This constant rain makes me feel so down. Can't shake this mood.,negative
MORNING EVERY1! Giveaway at http://tinyurl.com/dhc4hg  Mod Kid Emma pattern &$25 GiftCert to HipFabric!! GO check it out,neutral
"This gloomy weather is making me feel down, so depressing.",negative
Replied to an interesting article I came across online. It sparked some thought-provoking discussions.,neutral
Caught up with an old friend over coffee. It's always nice to reconnect and reminisce.,neutral
The weather is so gloomy and depressing today. It's ruining my mood.,negative
"This rain is ruining my plans, what a disappointment.",negative
Happy Birthday to the most amazing friend. Thank you for always being there for me. Let's celebrate big!,positive
This is truly enlightening for me,positive
Just wanted to remind you how awesome you are.,positive
Thinking of you and sending love your way.,positive
Congratulations to my friend on her new promotion! She worked hard for this and deserves all the success. So proud of you!,positive
Enjoying a peaceful afternoon with a cup of tea and my favorite book. Perfect way to relax!,neutral
Trying to get some work done not too happy about work situation,positive
Western Digital Caviar Black 1TB SATA 300 NCQ 32MB on the way...,neutral
Somewhere in the center...,neutral
"And figuring out how to watch Middlesbrough games next year, after the dreaded drop.",neutral
"In worst case cenario, I`ll show up on OFFF with a white mask, and scare everyone. Even better: everyone should wear a mask besides me.",negative
Vote for Board of the Month May 2009 (licensed members only) http://tinyurl.com/c8uj28 Good luck everybody,positive
morning to all,neutral
I`m scared to set the pw on my BB bc I might forget it & end up losing all my data. But yet I have financial info on it. Catch 22,negative
Going to school =[ I`m actually not so tired today tho,positive
"i`m not at chaseton`s either  please don`t die, my heart will be really sad",negative
one day my hugs will come    *fingers still crossed*,positive
Just got a shot on my arm. Eww.,neutral
"okay, i`m out for a while  back later!",neutral
Sad. I don`t know what to do with my life. Everything I have done since the age of 16 has been towards healthcare and nursing,negative
Just wanted to say thank you for being you. You're amazing!,positive
Well for one thing I might be branded a 'public menace' by the state.,neutral
Feeling excluded while everyone else is having a great time.,negative
Got home from work and now binge-watching my favorite series. Perfect way to unwind!,neutral
"I`ve already done my washing, I have a spring in my step this morning",neutral
"Just my luck, got stuck in traffic again.",negative
"Stuck in a never-ending line of traffic, will never make it on time.",negative
I feel so alone. It's like nobody understands me.,negative
No one wants to sit with me at lunch  I guess I`ll just bury my head in my laptop and continue to be anti-social.,negative
I can't believe I got rejected again. It's like I'm not good enough.,negative
He broke my heart into a million pieces. I don't know how I'll ever recover.,negative
"This gloomy weather is making me feel miserable, can't stand it.",negative
"Feeling so envious of everyone with a perfect life, I wish mine was the same.",negative
"Still recovering from the emotional pain caused by a betrayal, it's a long process.",negative
p.s.  thought you were gonna follow me back on twit-har ?,neutral
Yay my friend Glen is here. Now i`m like this,positive
I can't believe how much she hurt me with her words. It's like a punch to the gut.,negative
Congrats on your promotion! Well done!,positive
My day has been a disaster from start to finish. Can't catch a break.,negative
Off to church now...,neutral
hey how is everything going? please reply back. sometimes i think you hate me because you never reply back to me,negative
Round two of Vega: Vanilla Chai flavor.  Just realized that I have only 45 days left,neutral
"ummm, come on, for me twins and slurpees, and being in a car with the twins is going to be pretty epic!!!",positive
"Just when I thought things couldn't get any worse, I stubbed my toe.",negative
"Been reading a lot lately, time to dive into another book.",neutral
LMAO! listening to the great Bob Marley!  Wow hes so awesome,positive
"A lovely weekend away at Kits Coty, now relaxed and well rested and ready for the week ahead.  Back on NNC in two weeks",positive
i have been in the lounge for HOURS...and i have not been productive at all. upps time to go out,negative
Great !!! Your book looks fantastic ? I want it,positive
Looking forward to a quiet evening at home.,neutral
"It Was The Best Evar & My First,, You Didnt Awnser Any Of My Questions  xoxo",positive
"i like this new trend ,  who`s next ? http://tinyurl.com/qcy8d4",positive
Congratulations to my cousin for getting accepted into her dream university! You're going to do amazing things.,positive
I just got home.  i bought twiggies and a toothbrush that promises to make my teeth 60% cleaner. - http://tweet.sg,positive
Yes. I also use my desktop`s mouse and ketboard as if ot was just a second monitor   http://twitpic.com/4wlpf,neutral
A shoutout to my incredible mentor for guiding me to success. Your wisdom and support mean the world to me.,positive
Good morning Twitter fam! Just here to spread some positive vibes and brighten up your day. Stay amazing!,positive
Shoutout to my incredible parents for always supporting me and believing in my dreams. I'm grateful for everything you do. Love you both!,positive
The bus never showed up. Now I'm late for work. This is just great.,negative
I can't believe my best friend betrayed me. It hurts so much.,negative
Why does it always have to rain on my days off? It's so annoying.,negative
ahh..my stomach hurts,negative
I`m bummed that I didn`t get TEDx tickets,negative
i would love to come visit you in Korea.. next flight that is under 100 i am there!,positive
"The storm ruined our picnic plans, what a disappointment.",negative
my youtube channel? Demilynnmusic haha cause I love 2 sing & stuff so yea,positive
cant decide on wht i wanna do with the rest of my day...i think i may go bk 2 sleep  woe is me! uugghh! lol,neutral
http://bit.ly/13f5m0  You are not alone in your disbelief but I am quite happy with evolution. It beats the alternatives posited,neutral
is really ultra bored,negative
"Thinking about my plans for the weekend, so many possibilities!",neutral
You're an incredible friend and I'm grateful to have you in my life. Thank you for always being there for me. Sending you lots of love and appreciation!,positive
I hate this rain. It's making everything so miserable.,negative
Weekend plans: exploring the local farmer's market. Fresh produce here I come!,neutral
is it unny today or not? taking too long to decide haha. i wna get a tan,neutral
@_anniemay OMG No fair,negative
"Just had my teeth checked, now my eyes. I`m dying for a coffee but can`t drink for an hour.",negative
finally get my hands on my laptop!  just ate the biggest burrito de asada EVER  and now im gonna get ready for the party-ooo!,neutral
_zulu or get up on that Michael Jackson ish.  Not a bad look IMO,positive
"Just finished a delicious meal, feeling satisfied.",neutral
"Hope today brings you lots of laughter, love, and happiness. Enjoy every moment and make the most of this beautiful day. You deserve it!",positive
This coffee tastes awful. I wasted my money on this.,negative
i joined this because i think my smith chips invent a flavour competion entry wont be recognised  its  SWEETPOTATOE AND SEASALT  flavour ?,neutral
aww lovely pic,positive
"Just when I thought things couldn't get any worse, they did.",negative
Today's agenda: pampering myself with a spa day. Self-love is the best investment!,neutral
A big shoutout to my best friend for always being there for me. I am so grateful to have you in my life!,positive
"Another day, another failure. When will I catch a break?",negative
Deathstar destroys Starship Enterprice http://bit.ly/2agcTh Can`t get enough of this video  #starwars #startrek,negative
"Congratulations to my amazing cousin on her wedding! Wishing you a lifetime of love, laughter, and happiness. Cheers to the newlyweds! #wedding",positive
Received a lovely surprise gift from a friend. Feeling grateful and loved!,neutral
man i **** up that test  playing cod now . 31 days till the summer !,negative
"The bus never shows up on time, making me late for work.",negative
orralle.. have fun,positive
Response to a heartwarming message from a friend. It's moments like these that remind me of the importance of friendship.,neutral
YOU MAKIN` ME ****,neutral
I know! I`m so slow its horrible. DON`T TELL ON ME!,negative
Congrats on completing your goal! Your hard work and dedication have paid off. Wishing you even greater success in the future. You rock!,positive
"coooooooool, yes, CIWWAF are awesome.",positive
"Spending the day exploring new places, so much to see.",neutral
"I miss you too, Mojokins! I go there, but not long enough to comment  Will do more this weekend!",negative
"This scorching heat is unbearable, can't even go outside.",negative
Finally finished all my work for the day. Time to relax and binge-watch my favorite TV show.,neutral
Just wanted to send some positive vibes your way.,positive
not doing relay  oh well.,negative
she was performing at the lifeball in vienna this year but unfortunately i didn`t get the chance to see her.,negative
VEGA UNDER FIREEEEEE,negative
_assassin  sucks about your cat... hope you guys feel better,neutral
Congratulations to my partner for winning the award. Your hard work and dedication are truly inspiring.,positive
Mama? you`re the best thing that ever happen to me. thanks for everything  & and sorry for hurting you... I LOVE YOU!  <3,positive
Mmm someone come havelunch with me,neutral
"Happy Holidays to all my friends and family. May this season be filled with love, laughter, and warmth.",positive
Wishing you a wonderful day filled with love and laughter. Have a fantastic day ahead!,positive
http://twitpic.com/4jg09 - looks exactly like I do when I get that GH guitar in my hand,neutral
here again in school bored wanting  2 go home,negative
Still healing from the emotional trauma caused by a toxic relationship.,negative
"Chilling on the couch, enjoying a lazy afternoon.",neutral
Ohhh Ladyhawke is on channel 4  I sort of have a thing for Rutger Hauer http://twitpic.com/4jbzv,neutral
"Just when I thought things couldn't get worse, I got a flat tire.",negative
_G yup - that`s where I watch all my movies,neutral
"Missed my bus again because it arrived early, so frustrating.",negative
"Pleased to hear it, but still I am shamed sometimes to hear what some men do",negative
Why does it have to be so hot and humid? I can't stand it.,negative
Aww man I left all my laffy taffy`s at work,neutral
"Loving the weather today, perfect for a walk in the park.",neutral
_bach daps were the best lol,positive
"I wake up at 4:30 during the week - and funny, Deathcab makes me think of you!  (& I use your calendar to track work hours)",positive
#justcause Summer Hours say our day ends at 1pm...doesn`t mean I really get to leave at 1.,negative
You're amazing! Keep shining and spreading positivity.,positive
Rain Rain Rain go away come back next week when I`m gone (via ) raining lie crazy in the Keys,neutral
"Went to a party last night. Dindin and I showed up in matching outfits ) GREAT MINDS THINK ALIKE ) Anyway, happy birthday, ate lara",positive
That sounds cool! And you`re paying - even better,positive
My back is killing me. Stupid softball,negative
"Every time I succeed with a code, I get 'We`re Sorry. Your Credit Card Has Been Declined at this time.",negative
http://twitpic.com/67kb6 - Sad day!  What a great guy and enthusiastic teacher.,neutral
"Getting ready to go for a run, need to stay active.",neutral
Still feeling hurt from the emotional damage caused by someone I trusted.,negative
"This constant rain is spoiling all my plans, so frustrating.",negative
My back is killing me. I can't even sit properly.,negative
you and I apparently  how are you?,neutral
", you make baby jeebus cry",negative
"is going to be in Cincinnati all day Sunday...visitin` with an old friend/brother from Korea, then a date with someone special",positive
I can't escape this overwhelming feeling of sadness. It's suffocating.,negative
My cat died of kidney failure during my math test  This day needs to get better.,neutral
My boss yelled at me again today. I can't take it anymore.,negative
Happy birthday! May all your wishes come true.,positive
let me out,neutral
Waaaa. I ran my machine problem! Yeah!,neutral
"_ hehe go dye it beb! put more blonde innn  mine is lighter than it was, left it in  a bit too long oops><",neutral
My tummy hurts  go away cramps! I hate chuu!!!!,negative
im allergic to cats! my tonsils get swollen and they hurt  what do i dooo?!,negative
Greetings to all the early risers out there. Rise and shine! May your day be filled with productivity and positivity.,positive
"Getting ready for a night out, time to get dressed up.",neutral
You're a superstar! Keep shining and reaching for the stars.,positive
I really need to invest in an elliptical machine... Running with shin splints sucks!!,negative
"Thanks!  Unfortunately the EU had probs with his satellite provider, so even though his TV LOOKS great, it`s basically useless",neutral
I miss the warmth and sunshine of summer. Winter is so depressing.,negative
"Hey, sorry I didn`t get in touch sooner! We didn`t go by Bologna. It was out of our way",negative
"Just got back from work, OT na naman. What`s new?",neutral
"A shoutout to my amazing team at work. Together, we can achieve anything! Let's keep up the great work.",positive
has a headaaaaaaaaaaaache,negative
Who builds a hotel without air-con? Bloody boiling in here...,negative
Feeling thankful for the little things in life.,neutral
oooh im sorry to late i smashed it,negative
"Oh, I see!  So it`s like, morning there, right? Happy breakfast! *thumbs up*",positive
Just wanted to say thank you to all my amazing friends for always being there for me. You make life so much better. Love you all!,positive
Yey! holiday Monday in Uk today ... have a chilled day,neutral
about to start work and missing him like crazy.I wont be seeing him till Tuesday,negative
I guess I am too freaky for followers.,negative
My toothache is killing me. I can't focus on anything else.,negative
Got that right! And i know when I found out she wasn`t coming i cried!  It really sucks but Im still happy she headlining  now!,neutral
"sorry guys, the WAVVES show was canceled, they missed their flight",negative
"Feeling hungry, thinking about ordering some pizza.",neutral
Just finished reading a captivating book. Time to dive into another adventure!,neutral
Getting some work done before the weekend begins.,neutral
I want to see 'Too Fast to Transport in 60 seconds,neutral
"This constant rain is ruining my mood, so fed up.",negative
The bus broke down again. This is becoming a daily occurrence.,negative
Oh I know. For a while they cancelled the 5pm Oxford to Paddington every Friday evening because of staff shortages,neutral
yaaw some one want call with me?? 5529634599,neutral
Going home but will be back! After I get groceries and stuff,neutral
"Time to catch up on my favorite TV series, can't wait!",neutral
Seeing other couples just reminds me of how alone I am. It hurts.,negative
Congratulations to my niece for winning first place in the science fair. You're a star!,positive
Happy Birthday! Hope your day is filled with lots of love and joy. Have a fantastic year ahead!,positive
night to  - the light dims as you leave the chat room,neutral
2am feedings for the baby are fun when he is all smiles and coos,positive
This breakup has left me feeling so empty. I don't know how to move on.,negative
"This constant rain is ruining my plans, so frustrating.",negative
Just finished cooking dinner for the fam. Now time to dig in and enjoy the meal!,neutral
looking for new ideas for my blog,neutral
also just hanging right now?? just bored hahaha didn`t have to work again today this is different....  no hours no money lol whatev,negative
"I have myself barely 4 hrs of sleep and the Lord blessed me with what feels like 8, but it came with a sore throat  pumpin out this paper!",neutral
early phonograph industry? done.. just the rest of APM to revise  and only berry the green rabbit and ribena man for company,neutral
My head is pounding. I can't even think straight.,negative
Congratulations to my brother for winning the talent show! You never fail to impress. Keep shining!,positive
Get into me not going. lol at least I didnt get my hopes up,negative
Haha yea  if i knew yew wanted 2 go i would have told yew,neutral
"The wifi is so slow, it's driving me crazy. I can't get anything done.",negative
soo tired.. still kinda angry that i missed the concert,negative
it`s friday night. i`m home. no party this weekend,negative
"Enjoying a lazy Sunday at home, cuddled up with a book and a cup of coffee. Bliss!",neutral
Attending a virtual event later. Excited to learn and connect with like-minded individuals!,neutral
Going for a long drive to explore some scenic routes. Can't wait to soak in the beauty of nature!,neutral
My allergies are acting up and I can't stop sneezing. It's unbearable.,negative
My stomach hurts so bad. I can't even eat anything.,negative
"Can't believe it's snowing again, this weather is depressing.",negative
Happy Birthday to my partner in crime. Here's to another year of adventures and unforgettable memories.,positive
has a headache already?  boo,negative
Congratulations on your achievements! You're unstoppable.,positive
sad   Miss my friends !,negative
"Having a movie night with friends. Popcorn, blankets, and a good film. Perfect evening!",neutral
then u should went to vegas like u did last year  I think this was around the time u killed that animal with ur old car LOL,neutral
